title,url,content
АКШ бәйсезлеге өчен сугыш,https://tt.wikipedia.org/wiki/%D0%90%D0%9A%D0%A8_%D0%B1%D3%99%D0%B9%D1%81%D0%B5%D0%B7%D0%BB%D0%B5%D0%B3%D0%B5_%D3%A9%D1%87%D0%B5%D0%BD_%D1%81%D1%83%D0%B3%D1%8B%D1%88,"АКШ бәйсезлеге өчен сугыш (ингл. American Revolutionary War, American War of Independence; 1775—1783) — бер яктан Бөекбритания һәм лоялистлар, икенче яктан АКШ арасында булган сугыш. Сугыш нәтиҗәсендә Америка җирләрендә урнашкан штатлар берләшеп бәйсез Америка Кушма Штатларын төзиләр."
Беренче инглиз-бур сугышы,https://tt.wikipedia.org/wiki/%D0%91%D0%B5%D1%80%D0%B5%D0%BD%D1%87%D0%B5_%D0%B8%D0%BD%D0%B3%D0%BB%D0%B8%D0%B7-%D0%B1%D1%83%D1%80_%D1%81%D1%83%D0%B3%D1%8B%D1%88%D1%8B,"Беренче инглиз-бур сугышы яки Трансвааль сугышы (африкаанс: Eerste Vryheidsoorlog) — Инглиз-бур сугышларының беренче өлеше. 1880 елның 16 декабрендә башланып, 1881 елның 23 мартында тәмамланган.
Сугыш сәбәбе — Британ империясенең территориаль экспансиясе. Көньяк Африка җирләре табигый ресурсларга бай, 1877 елда Көньяк Африка Җөмһүриятенең британнар тарафыннан аннексациясе була. Бурлар исә моң каршылык белдерә.
1880 елның 16 декабрендә трансвааль бурлары британ окупантларына ут ача. Британ гарнизоны булган торак пунктлар камап алына. Британнарның каршылык күрсәтү омтылышы уңышсыз уза. Озакка сугышка керергә теләмәгән Уильям Гладстон хөкүмәте 1881 елның 6 мартында тынычлык килешүен имзалый. Тынычлык үзе 1881 елның 3 мартында гына урнаша. Трансваальда үзидарәчелек өчен тулы хокукы кала, тик ул Британ империясенең сюзеренитетын танырга тиеш. Ләкин 1899—1902 елларда инглиз-бур сугышы янә кабына.


== Сылтамалар ==
Инглиз-бур сугышлары (рус.)"
Бурсыклы буендагы бәрелеш,https://tt.wikipedia.org/wiki/%D0%91%D1%83%D1%80%D1%81%D1%8B%D0%BA%D0%BB%D1%8B_%D0%B1%D1%83%D0%B5%D0%BD%D0%B4%D0%B0%D0%B3%D1%8B_%D0%B1%D3%99%D1%80%D0%B5%D0%BB%D0%B5%D1%88,"Бурсыклы буендагы бәрелеш — 1399 елның 12 августында бер яктан Алтын Урданың ханы Тимер Котлыг һәм бәкләрибәге Идегәй җитәкчелегендәге  татар гаскәре һәм икенче яктан Витаутас кенәзе җитәкчелегендәге Бөек Литва кенәзлегенең   һәм аның урыс, ләх, алман беректәшләре  бердәм гаскәре арасында хәлиткеч бәрелеш.   XIV гасырның Көнчыгыш Аурупада иң эре бәрелеше.
Бәрелеш нәтиҗәсендә татар гаскәре урыс-алман-ләх бердәм гаскәрен җиңә,  Литва гаскәрен тулысынча тар-мар итә.
Бәрелештән соң Бөек Литва кенәзлеге түбән төшә башлый, бәкләрибәк Идегәйнең дошманы һәм Витаутсны яклаган элекке хан Туктамыш үз сәяси йогынтысын югалта һәм Алтын Урда тәхетенә өчен көрәштә җиңелә. Ләкин соңрак Туктамыш улы Җәләл әд-Дин Витаутасны яклап  Грүнвальд сугышында катнашып Тевтон орденын җиңә, шуңа күрә Бурсыклы буендагы бәрелештә җиңелүнең нәтиҗәләре  Витаутас өчен тулы катастрофага әйләнмәгән. Ә Җәләл әд-Дин белән киткән татарлар Бөек Литва кенәзлегендә урнаштырыла һәм Польша-Литва татарлары нәселенә нигез сала.


== Тарих ==
1390 елларда Туктамыш хан Аксак Тимер ханга ике мөһим бәрелештә җиңелә. Аксак Тимер гаскәре Алтын Урданың Идел буе шәһәрләрен җимерә, дәүләтнең икътисады түбән төшә.
1398 елда Алтын Урданы берләштерергә тырышкан  Туктамыш хан көчле һәм куркыныч көндәше Тимер Котлыг хан белән сугышып җиңелә.
Җиңелгәннән соң Туктамыш гаиләсе белән Витаутаска Киев шәһәренә качып китә. Тимер Котлыг үз дошманы Туктамышны Витаутастан кайтаруны таләп итә. Витаутас баш тарта һәм 1398 елда Бурсыклы елгасына  яу белән бара.
Витаутас җитәкләгән гаскәрдә кенәзләр Андрей Ольгердович Полоцкий, Дмитрий Ольгердович Брянский, Дмитрий Кориатович, Иван Борисович Киевский, Глеб Святославич Смоленский һәм Дмитрий Данилович Острожский, шулай ук Мамай нәселеннән Александр Мансур улы (Елена Глинская һәм Явыз Иванның  бабасы), Туктамыш берничә меңле отряды белән һәм Тевтон орденының кайбер алпарлары.


== Бәрелеш барышы ==
1399 елның язында Витаутасның бердәм гаскәре Киевта җыела башлый, августта Бурсыклы елгасына килеп җитә. Тимер Котлыг Витаутасның гаскәр зурлыгын күреп, башта бәрелештән китәргә җыена, ләкин бәкләрибәк Идегәй ногай татарлары гаскәре белән килеп вәзгыятьне нык үзгәртә.
12 августта бәрелеш башлана. Татарлар, юри чигенеп, дошманны тозакка хәйләләп кертә, ә литва-урыс-ләх гаскәре эзәрләргә ташлана һәм тозакка эләгә. Татарлар 10-12 чакрымда чигенеп туктыйлар һәм һөҗүм итә башлый,  ә татар атлы гаскәрләре Витаутасның гаскәре тылына һөҗүм итә.
Гәрчә Витаутасның гаскәре ишлерәк булса да һәм анда туплар, иске мылтыклар (пищаль) булса да, Витаутас гаскәре тулысынча тар-мар ителә.
Туктамыш Витаутасның хатасын күреп, үз гаскәрен сугыштан алып китә.
Татар гаскәре Витаутасның калган гаскәрен Киевка кадәр куып бара, күпчелек гаскәр башлыклары һәлак була, Витаутас көчкә генә котыла. Витаутас, Туктамыш, алман беректәшләре сугыш кырыннан кача.
Киев татарларга 3000 литва гривнасын түләп шәһәрне җимерүдән саклый.
Идегәй хәрби данын күтәрә, һәм Алтын Урданың куәтен күрсәтә.


== Сылтамалар ==
Равил Фәхретдинов. ТАТАР ХАЛКЫ ҺӘМ ТАТАРСТАН ТАРИХЫ.
Сахаров Н.А. Битва на Сити в летописях, преданиях, литературе. Заметки на полях. — Издатель Александр Рутман, 2008.
Мыськов Е. П. Политическая история Золотой Орды (1236—1313 гг.). — Волгоград: Издательство Волгоградского государственного университета, 2003. — 178 с. — 250 экз. — ISBN 5-85534-807-5
Горелик М. Оружие Ворсклинской битвы // Цейхгауз. — 1993. — № 3.
Гудавичюс Э. История Литвы. Том 1: С древнейших времён до 1569 года. — М., 2005. — 680 с.
Измайлов И. Битва на Ворскле. 1399. Звёздный час эмира Идегея… // Цейхгауз. — 1993. — № 3.
Шабульдо Ф. М. Земли Юго-Западной Руси в составе Великого княжества Литовского. — Киев, 1987."
Бәдер сугышы,https://tt.wikipedia.org/wiki/%D0%91%D3%99%D0%B4%D0%B5%D1%80_%D1%81%D1%83%D0%B3%D1%8B%D1%88%D1%8B,"Бәдер сугышы (гар.غزوة بدر)— мөселманнар һәм потка табынучы көрәешләр арасындагы, Һиҗрәтнең икенче елында Рамазан аеның 17 нче көнендә, җомга көнне (624 ел, 17 март) килеп чыккан беренче мөһим сугыш. Ул Хиҗаз җирлегендә, Бәдер коелары янында була. Мөселманнарның бу сугышта җиңүе исламның таралуын Өхед сугышындагы (627 ел) җиңелүләренә кадәр көчәйтә. Мөселманнар гаскәрендә 300-317 кеше була: 82-86 мөһәҗир, 61 кеше Аус, 170 Хәзрәҗ кабиләсеннән.


== Корәйшиләргә каршы сугышның сәбәпләре ==
Мөхәммәд пәйгамбәр эшчәнлегенең Мәккә чорында, мөселманнарны мәсхәрәләү, янау, бойкот, кыйнау, үлем куркычына дучар иткәннәр. Бу Мөхәммәд пәйгамбәрне мөселманнарны Хәбәшстанга күчерергә, ә аннары Йәсрибкә (Мәдинәгә) күченеп китәргә мәҗбүр итә. Мәдинәлеләр ислам кабул итү сәбәпле, мөселманнарның хәлләре ныгый: аларның гаскәрләре барлыкка килә, ләкин корәешләрнең гаскәрләре күбрәк санлы була. Мәдинә шәһәре яныннан мәккә сәүдәгәрләренең кәрваннары үткән, мөселманнар башта шул кәрваннага һөҗүм итәләр. Шундый һөҗүмнәр нәтиҗәсендә, корәешләрнең башлыкларына басым ясалган, шулай ук мөселманнарның тартып алынган малларының бер өлеше кире кайтарылган.


== Бәдер сугышының үзенчәлекләре ==
Бу сугышның зур мөһимлегенә карамастан, бер мең тирәсе корәешләр гаскәреннән (Г. Лебон 2000 санын күрсәтә) 70 кеше генә үтерелә (Ибн Исхак әйтүенчә, 50 кеше), а 300 тирәсе мөселманнардан – 14. Шулай итеп, сугышта катнашучыларның 6,4 %ы гына һәлак була. Дөрес, кайбер мөселманнар, мәсәлән Сәгъд ибне Мугъаз, дошманнарны мондый мөһим сугышта исән калдыру белән риза булмаганнар. Мөхәммәд пәйгамбәр, кайбер кешеләернең, мәсәлән Бану Хәшимлеләр, үз теләкләренә каршы чыкканарын белгәч, аларны үтерүне тыя. Шул ук сәбәптән абыйсын үтерүне дә тыя.
Язмаларда бу сугышта фәрештәләрнең катнашуы турында да әйтелә. Бу фәрештәләр катнашкан бердәнбер сугыш була (аларың булуын мөшрикләр дә таныганнар, мәсәлән Әбу Суфьян).


== Бәрелеш ==
Мөхәммәт пәйгамбәргә Әбу Суфьян ибне Хәрб җитәкчелегендәге корәешләрнең зур кәрваны Сүриядән кайтуы турында хәбәр килә. Кәрван 30 яки 40 кешедән торган. Хиҗазга килеп җитүче Әбу Суфьян мөселманнарның һөҗүм әзерләвен белеп ала, һәм ул Мәккәгә, корәешләрне сугышка чакырырга, кеше яллап җибәрә. Бөтен корәеш аксөякләре бәрелешкә әзерләнәләр, Әбу Ләһәбтән башка – ул үзенең урынына әл-ас ибне Хишәм ибнел-Мугъыйрәне җибәрә. Бәну Адий ибн Кәгб нәселеннән башка, барлык ншселләрдән дә вәкилләр була.
Мөхәммәд пәйгамбәр дүшәмбедә, Рамазаннаң 8 нче көнендә, юлга чыга, үзе урынына Амр ибне Үмм Мәктумны калдырып. Аннары Әбу Лубәбәне кире кайтара һәм Мәдинә башлыгы итеп билгели. Мөхәммәд пәйгамбәр сугыш байрагын Мусаб Ибне Гумәйргә бирә. Пәйгамбәрнең үзенең алдында ике кара байрак була: берсе Гали ибне Әбу Талибта, икечесе әнсарларда. Дөяләрнең саны җитмешкә җиткән, ләкин атлар саны ике генә була (ә мөшрикләрнең – 100). Сәхабәләр бер дөядә берничәүләп утырганнар. Мөхәммәд пәйгамбәр бер дөядә Гали һәм Мәрсад ибне Әҗбу Мәрсад әл-Ганәви белән бергә утырган. Тылда башлык итеп Бәну Мәзин ибн ан-Нәҗҗәр нәселеннән Кайса ибн Саасаа билгеләнә. Ибне Хишам тапшыруынча, әнсарларның байрагы Сәгъд ибне Мугъазда була. 
Мөхәммәд пәйгамбәргә корәешләрнең кәрваннарын яклау өчен чыгулары турында хәбәр килеп ирешә. Мөселманнар Бәдер үзәнлегенә килеп җиткәч, пәйгамбәр бер сәхабә белән гаскәрләрдән аерыла, бер бәдәвине очратып, үзенең кем икәнлеген белгертмичә, аңардан мөселманнарның һәм корәешләрнең торган урыннары турында сораша. Мөхәммәд пәйгамбәр башкалар янына кайта, ә кич җиткәч, Гали, Зүбәйр ибнел-Гәввам, Сәгъд ибн Әбу Ваккас һәм башка кайбер сәхабәләрне, алар корәешләр турында белешсеннәр дип, Бәдер сулары янына җибәрә. Алар анда Бәну әл-Хәҗәҗ хезмәтчесе – Әсләмә һәм Бәну әл-Ас ибне Сәет хезмәтчесе – Әрид Әбу Йәсарны очраталар, үзләре белән алып китәләр һәм сорау алу үткәрәләр.Бу сугышка Мәккә шәһәренең бөтен аксөякләре диярлек чыкканлыгы беленә. Бәсбәс ибне Әмр һәм Адий ибне Әбу әз-Зәгъбә, күзәтчелек ясап, корәешләрнең иртәгә яки берсекөнгә киләчәкләрен беләләр.
Мөшрикләрнең гаскәре кызу төньякка Бәдер янына якынлаша. Юлда алар, Әбу Суфьянның, Бәдерне якта калдырып, Кызыл диңгез ягына таба борылуы сәбәпле, мөселманнардан кача алуы турында хәбәр алалар. Корәешләрнең гаскәрләре кайту теләген белдерә, ләкин Әбу Җәһел каршы була – ул Бәдергә юнәлеп, мөселманнарны куырга тели. Шулай да Бәну Захра нәселе кире кайта, ә калган гаскәрләрнең саны меңгә җитә.
Корәешләр әл-Әкәнкәл ком калкулыгы янында туктыйлар. Үзәнлектә яңгыр башлана. Җирнең балчыклануы сәбәпле, корәешләр юлларын дәвам иттерә алмый башлыйлар. Мөселманнарның юлында шулай ук яңгыр ява, ләкин алар юлларын дәвам иттереп, коеларга беренче булып килеп җитәләр. Мөселманнар бөтен коеларны күмәләр, үзләре туктаган коедан башка – алар аңардан сулык төзиләр. Әл-Әсуад ибн Габдел-Асад әл-Мәхзуми – сугышның беренче корбаны була. Ул Хәмзә ибне Габдел-Мотталиб белән сугышканда үтерелә. 3 бергә-бер чыгып сугышудан соң, бәрелеш башлана. Бәрелеш нәтиҗәсендә мөселманнар җиңүгә ирешәләр, ә мөшрикләрнең гаскәре тар-мар ителә. Мөселманнардан 14 үтерелә, ә корәешләрдән 70 кеше һәм шуның хәтлек үк әсирлеккә алына. Бу сугышта мөселманнарның төп дошманнарыннан берсе – Әбу Җәһел үтерелә..


== Әсирләргә мөнәсәбәт ==

Әсирләрдән ике кешене җәзалыйлар – алар мөселманнарга дошманлыклары белән аерылып торган Укбә ибне Әбу Мугәйт һәм ән-Нәдр ибнел-Харис булалар. Әсрләрне сәхабәләр арасында бүләләр. Мөхәммәд пәйгамбәр әсирләргә яхшы мөгамәләдә булырга куша. Мөслманнар бу әмерне үтиләр: үзләре хөрмә ашаганда да, әсирләргә ипи ашатканнар (хөрмә ярлыларның азыгы булып саналган).
Әсирләрне бер кеше өчен меңнән алып дүрт меңгәчә дирхәм акчага азат иткәннәр. Ә акчалары булмаганнарны, ярлыларны түләүсез иреккә җибәрәләр.


== Искәрмәләр =="
