title,url,content
Киев шәһәрен камап алу (1240),https://tt.wikipedia.org/wiki/%D0%9A%D0%B8%D0%B5%D0%B2_%D1%88%D3%99%D2%BB%D3%99%D1%80%D0%B5%D0%BD_%D0%BA%D0%B0%D0%BC%D0%B0%D0%BF_%D0%B0%D0%BB%D1%83_(1240),"Киев шәһәрен камап алу (1240) — татар-монголларның көнбатыш явының (1236-1242) төп вагыйгаларының берсе. Бату хан  һәм Сөбедәй батыр җитәкләгән татар-монгол гаскәре Киев шәһәрен 9 көн дәвамында яулап ала (бүтән чыганак буенча камап алу 1240 елның 5 сентябреннән 19 ноябренә кадәр сузыла).
1240-1242 елларда Бату хан һәм Сөбедәй гаскәр башлыгы җитәкчелегендәге икенче яу башлана, аның төп максаты - Даниил Галицкий биләмәләре, Польша һәм Маҗарстанны яулап алу булып тора.


== Тарих ==
1223 елда Сөбедәй һәм Җәбә батырлар җитәкләгән татар-монгол гаскәре бердәм урыс-коман гаскәрен Калка елгасында җиңә, соңрак Киевка таба юнәлә, ләкин барып җитмичә көнчыгышка борыла.
Көнбатыш яу вакытында татар-монгол гаскәре көнчыгыш Русияне яулап ала, 1239-1240 елларда Чернигов кенәзлеген басып алганнан соң Мәңге гаскәре Днепр елгасына барып җитә һәм Киевка илчелекне җибәрә.
Киевлеләр татар-монгол илчелеген үтерә, әлеге вакыйга татарлар өчен зур хурлау булып саналган, элегрәк нәкъ шундый сәбәпләрдән Хәрәзем һәм бөтен Мавараэннәһер басып алынган булган.
Киев кенәзе Михаил Всеволод улы Маҗарстанга китә һәм анда маҗар патшасы Белла 4 белән берек төзергә тырыша, ләкин уңышсыз булып чыга.
Илчелекне үтерү сәбәпле татар-монгол гаскәре 1240 елның 5 сентябрендә Киевне камапышка ала.
5 декабрендә татар-монгол гаскәре  Киев шәһәренең диварын берничә урында җимерә һәм калага һөҗүм итеп ала.
Соңрак татар-монгол гаскәре Волынь кенәзлегенә юнәлә, ә Кадан һәм Байдар җитәкләгән гаскәр көнбатыш явын дәвам итә.


== Нәтиҗә ==
Татар-монгол гаскәре җиңгәннән соң Киев шәһәре һәм бөтен Украина Алтын Урдага керә. Украина татар хакимияте астында 1240-1362 еллар дәвамында була. Алтын Урдада чуалыш чорындагы Зәңгәр Су буендагы бәрелештән соң Киев һәм көнбатыш Украина Бөек Литва кенәзлегенә кушыла.


== Сылтамалар ==
Равил Фәхретдинов. ТАТАР ХАЛКЫ ҺӘМ ТАТАРСТАН ТАРИХЫ.
Храпачевский Р. Великий западный поход чингизидов на Булгар, Русь и Центральную Европу // Военная держава Чингисхана. — М. 2004.
(укр.)   Івакін Г. Ю.  Історичний розвиток Києва XIII — середини XVI ст. (історико-топографічні нариси). — К., 1996. — 272 с. ISBN 5-85654-047-6
Мыськов Е. П. Политическая история Золотой Орды (1236—1313 гг.). — Волгоград: Издательство Волгоградского государственного университета, 2003. — 178 с. — 250 экз. — ISBN 5-85534-807-5
Почекаев Р. Ю. Цари ордынские. Биографии ханов и правителей Золотой Орды. — СПб.: ЕВРАЗИЯ, 2010. — 408 с. — 1000 экз. — ISBN 978-5-91852-010-9
Селезнёв Ю. В. Элита Золотой Орды. — Казань: Издательство «Фэн» АН РТ, 2009. — 232 с.↑ төрки телле халык гаскәрдә күпчелек тәшкил итә, ул заманда көнчыгыштагы төрки халык татарлар дип атала, шуңа күрә татар-монгол термины кулланыла

↑ Русия - урыс халкының тарихи җире, бүгенге Рәсәйнең көнбатыш өлкәләре"
Косово бәрелеше,https://tt.wikipedia.org/wiki/%D0%9A%D0%BE%D1%81%D0%BE%D0%B2%D0%BE_%D0%B1%D3%99%D1%80%D0%B5%D0%BB%D0%B5%D1%88%D0%B5,"Косово бәрелеше яки Косово кырында бәрелеш (сербча  Косовска битка яки бој на Косову; төрекчә Kosova Meydan Muharebesi) — 1389 елның 15 июнендә Косово кырында (бүгенге Приштинадан 5 километрда) булган бер яктан Сербия һәм Босния кыйраллыгы гаскәрләре, икенче яктан Госманлы империясенең гаскәре арасында зур канкойгыч бәрелеш.
Серб гаскәрен Лазарь Хребелянович, Вук Бранкович һәм бөек воевода Влатко Вукович җитәкләгән.
Госманлы империясенең гаскәрен солтан Мурад I, уллары Якуб һәм Бәязид Елдырым җитәкләгән.
Бәрелештә сугышкан гаскәрләрнең күпчелеге һәлак булган, Сербия гаскәр башлыгы Лазарь әсирлеккә эләккән һәм үтерелгән, солтан Мурад та вафат булган (фаразлавынча Милош Обилич тарафыннан үтерелгән).
Госманлы империясе җиңгәнгә карамастан солтанның гаскәре Андрианопольга тиз генә юнәлгән, чөнки Мурад I һәлак булганнан соң, Госман империясендә чуалышлар башланырга мөмкин булган.
Косово бәрелеше серб милли үзаңында, тарихта, фольклорда зур роль уйный.
Лазарь һәм Милош Обилич православ чиркәвендә әүлия булып хөрмәт ителә.


== Нәтиҗә ==
Косово бәрелешендә барлык диярлек серб аксөякләре һәлак булган, күп корбаннары сәбәпле Госманлы империясенең һөҗүменә каршылык күрсәтү өчен көчләре калмаган. Косово бәрелешеннән соң Сербия үз бәйсезлеген саклаган, ләкин тик 70 ел дәвамында.
1459 елда Госманлы империясенең гаскәре Сербияне тулысынча басып алган.


== Сылтамалар ==
Чиркович Сима. История сербов. — М.: Весь мир, 2009. — 448 с. — ISBN 978-5-7777-0431-3.
Листая страницы сербской истории / Е.Ю. Гуськова. — М.: Индрик, 2014. — 368 с. — ISBN 978-5-91674-301-2.
Владимир Чоровић. Историја Срба. Библиотека Растко. Archived from the original on 2012-12-23. Retrieved on 2012-12-22.
Димитрије Богдановић. Књига о Косову. Библиотека Растко. Archived from the original on 2012-12-23. Retrieved on 2012-12-22.
Жељко Фајфрић. Света лоза кнеза Лазара. Библиотека Растко. Archived from the original on 2012-12-23. Retrieved on 2012-12-22."
Ливония сугышы,https://tt.wikipedia.org/wiki/%D0%9B%D0%B8%D0%B2%D0%BE%D0%BD%D0%B8%D1%8F_%D1%81%D1%83%D0%B3%D1%8B%D1%88%D1%8B,"Ливония сугышы (рус. Ливонская война, алман. Livländischer Krieg) — зур хәрби конфликт. Егерме биш елга сузылган (1558—1583).


== Алшартлар ==
XV гасыр урталарында Ливония таркалган дәүләт берәмлеге була.


== Сәбәп ==
Тарихта Ливония сугышы башлануның турыдан-туры сәбәбе буенча төрле карашлар бар.


== Сугыш барышы ==
Сугыш башланганда Ливония ордены Рига архиепискобы һәм аның Сигизмунд II Август белән низагта җиңелү белән тагын да зәгыйфьләнә. Икенче яктан, Русия Казан һәм Әстерхан ханлыклары яулап алганнан соң, башкортлар, Зур Нугай Урдасы, казаклар һәм Кабардалар кушылганнан соң көч туплый башлаган.


== Сылтамалар ==
Послание Ивана Грозного вице-регенту Ливонии А. И. Полубенскому с обоснованием претензий на Пруссию и Прибалтику.
Послание Ивана Грозного королю Стефану Баторию 1581 года.
О Ливонской войне — сегодня. Интернет-журнал Гефтер (16.03.2016). Retrieved on 2016-06-04."
Сит бәрелеше,https://tt.wikipedia.org/wiki/%D0%A1%D0%B8%D1%82_%D0%B1%D3%99%D1%80%D0%B5%D0%BB%D0%B5%D1%88%D0%B5,"Сит бәрелеше яки Сить елгасында бәрелеш — 1238 елның 4 мартында  бер яктан Бурандай җитәкләгән татар-монгол гаскәре һәм  икенче яктан Владимир кенәзе Юрий Всеволод улы җитәкчелегендәге урыс гаскәре арасында хәлиткеч бәрелеш. Татар-монголларның көнбатыш яки кыпчак явының (1236—1242)  төп вакыйгаларының берсе.
Сит бәрелеше нәтиҗәсендә татар-монгол гаскәре  урыс гаскәрен тулысынча тар-мар итә, Владимир кенәзе һәлак була, Көньяк-Көнчыгыш Русия Татар-монгол империясенә кушыла.


== Тарих ==

1237 елның 16-21 декабрендә татар-монгол гаскәре Рәзән шәһәрен яулап ала, 1238 елның 1 гыйнварында урыс гаскәрен Коломна янында тар-мар итә.
Җиңгәннән соң татар-монгол гаскәре Владимир-Сүздәл кенәзлегенә керә, Владимир кенәзе Юрий башкалада гаиләсен калдырып, Сит янындагы урманга качып китә, һәм анда урыс гаскәрләрен җыя башлый.
Татар-монгол төп көчләре Твир, Торжок янына юнәлә, ә калган урта кул көчләрен Бурандай  Идел буе урыс шәһәрләренә таба алып китә.
Җыелган урыс гаскәрләре тиз татар һөҗүмен көтмичә ял итә, аракы эчкәли башлый. Бурандай җитәкчелегендәге татар-монгол корпусы Владимир шәһәрен алганнан соң, 3 атна дәвамында бик тиз Сит елгасына барып җитә. Хәлиткеч, көтелмәгән татар һөҗүме нәтиҗәсендә бөтен урыс гаскәре камалышка эләгә һәм тулысынча һәлак була диярлек, шул исәптән Владимир кенәзе, Ярыслау кенәзе үтерелә, соңрак Ростов кенәзе дә һәлак була.


== Нәтиҗәләр ==
Бурандайның хәлиткеч һөҗүме һәм җиңүе фактик рәвештә Русияне гаскәрсез калдыра диярлек. Бөтен көнчыгыш Русия Татар-монгол империясенә керә. Татар-монгол гаскәре ул заманда Русиянең төп шәһәре - Киевка һөҗүмгә әзерләнә башлый.


== Сылтамалар ==
Равил Фәхретдинов. ТАТАР ХАЛКЫ ҺӘМ ТАТАРСТАН ТАРИХЫ.
Сахаров Н.А. Битва на Сити в летописях, преданиях, литературе. Заметки на полях. — Издатель Александр Рутман, 2008.
Мыськов Е. П. Политическая история Золотой Орды (1236—1313 гг.). — Волгоград: Издательство Волгоградского государственного университета, 2003. — 178 с. — 250 экз. — ISBN 5-85534-807-5
Почекаев Р. Ю. Цари ордынские. Биографии ханов и правителей Золотой Орды. — СПб.: ЕВРАЗИЯ, 2010. — 408 с. — 1000 экз. — ISBN 978-5-91852-010-9
Селезнёв Ю. В. Элита Золотой Орды. — Казань: Издательство «Фэн» АН РТ, 2009. — 232 с.↑ төрки телле халык гаскәрдә күпчелек тәшкил итә, ул заманда көнчыгыштагы төрки халык татарлар дип атала, шуңа күрә татар-монгол термины кулланыла

↑ Русия - урыс халкының тарихи җире, бүгенге Рәсәйнең көнбатыш өлкәләре"
Совет-фин сугышы (1939-1940),https://tt.wikipedia.org/wiki/%D0%A1%D0%BE%D0%B2%D0%B5%D1%82-%D1%84%D0%B8%D0%BD_%D1%81%D1%83%D0%B3%D1%8B%D1%88%D1%8B_(1939-1940),"Совет-Фин сугышы - (фин. talvisota - кышкы сугыш) Совет Социалистик Республикалар Берлеге белән Финляндия арасында 1939-1940 елларда узган кораллы низаг. Сугыш Мәскәү солыхы (1940) белән тәмамланган. Бу солых буенча ССРБ составына Финляндия территориясенең 11% өлеше күчкән.
Чит гәлимнәр фикерләре буенча өченче совет-фин сугышы - Икенче бөтендөнья сугышы вакытында ССРБнең Финляндиягә һәҗүм итү, ләкин совет һәм урыс тарихында бу сугыш аерым күрсәтелә. Сугыш игълан итү сәбәпле ССРБ Милләтләр лигасыннан чыгарганнар.


== Моны да карагыз ==
Совет-фин сугышы (1941-1944)


== Искәрмәләр =="
Талас бәрелеше,https://tt.wikipedia.org/wiki/%D0%A2%D0%B0%D0%BB%D0%B0%D1%81_%D0%B1%D3%99%D1%80%D0%B5%D0%BB%D0%B5%D1%88%D0%B5,"Талас бәрелеше яки Атлах бәрелеше (кытайча 怛羅斯會戰, гарәпчә معركة نهر طلاس) — 751 елда Талас елгасында (бүгенге Казакъстанның Тараз шәһәре янында) Атлах шәһәре янында булган бер яктан Габбәс Хәлифәлеге һәм Төркеш каһанлыгы, икенче яктан Кытайның Таң династиясе гаскәре арасында Үзәк Азия өчен бәрелеш.


== Тарих ==
751 елга гарәп гаскәре Иран, Сүрия, Фәләстинне яулап ала, Көнбатыш Төрки Каһанлыгы һөҗүмгә каршылык күрсәткәнгә карамастан гарәпләр көнбатыш өлешен ала, Хәлифәлеккә кертелә һәм төбәктә Ислам тарала башлый.
749 елда Кытай гаскәр башлыгы Гао Сәнҗи Ташкәнт шәһәрен басып ала, төрки хаким Мохәдү не үтерә. Хәлифәнең җирле идарә вәкиле Әбү Мөслим Таразда гарәп гарнизонын сакласын өчен Кытай гаскәренә каршы Зияд ибн Салих җитәкчелегендәге Йәмән атлы гаскәрен җибәрә, аларга төрки гаскәр кушыла.
Бәрелештә һәр яктан 100 мең гаскәри катнашкан, 5 көн дәвамында сузылган. Бишенче көндә карлуклар көчләре кытай гаскәренең тылына һөҗүм итә һәм кытайлылар чигенергә мәҗбүр булалар.


== Әһәмият ==
Талас бәрелеше Кытайның Тан дәүләтенә көнбатышка алга китүне бирми, гарәп гаскәре дә зур зыян күрә, нәтиҗәдә Төркеш каһанлыгына һөҗүм туктый.
Талас бәрелешеннән соң Ән Лушән баш күтәрүе башлый һәм Кытай куәтен бик киметә, Тан нәселе чик буе гарнизоннарын көнчыгышка чакырырга мәҗбүр була.
Гарәпләр дә Талас үзәнендә кала алмаганнар һәм Шаш (Ташкәнт янында) төбәгенә чигенәләр.
Талас бәрелеше нәтиҗәсендә:

Гарәп гаскәренең көнчыгышка һөҗүме туктала
Ислам төрки халыклар арасында тарала башлый
Карлуклар бәйсез дәүләтен төзиләр
Кәгазь технологиясе әсирләр аша Көнбатышка килә
Уйгырлар Көнчыгыш Төркистанда үз дәүләтен торгыза
Кытайның Тан дәүләте  түбән төшә башлый һәм кытайлыларның көнбатышка таралышы 1000 елга диярлек туктатылган.


== Сылтамалар ==
Bartold, W [1928] (1992). (Western) Turkestan Down to the Mongol Invasion. New Delhi: Munshiram Manoharlal Publishers. ISBN 81-215-0544-3.
Beckwith, Christopher I. (2009): Empires of the Silk Road: A History of Central Eurasia from the Bronze Age to the Present. Princeton: *Princeton University Press. ISBN 978-0-691-13589-2.
Biran, Michal (October 2012). ""Kitan Migrations in Eurasia (10th–14th Centuries)"" (PDF). Journal of Central Eurasian Studies (Center for *Central Eurasian Studies) 3: 85–108. Retrieved 3 May 2014.
Bloodworth, Dennis; Bloodworth, Ching Ping (2004). The Chinese Machiavelli: 3000 years of Chinese statecraft. Transaction Publishers. ISBN 0-7658-0568-5. Retrieved 3 May 2014.
Bulliet, Richard; Crossley, Pamela; Headrick, Daniel; Hirsch, Steven; Johnson, Lyman (2010). The Earth and Its Peoples (5 ed.). Cengage Learning. ISBN 0538744383. Retrieved 3 May 2014."
Төньяк сугыш,https://tt.wikipedia.org/wiki/%D0%A2%D3%A9%D0%BD%D1%8C%D1%8F%D0%BA_%D1%81%D1%83%D0%B3%D1%8B%D1%88,"Төньяк сугыш шулай ук Унике еллык сугыш (1700-1721) Пётр I һәм аның союздашлары Саксония белән Даниянең Швециягә каршы сугышы. Бу Пётр I идарәсе вакытының  төп вакыйгасы булып тора. Сугышның максаты - Балтыйк диңгезенә чыгып тирә-юнгә Русиянең сугышчан-сәяси һәм икътисади экспансиясен тарату.
Пётр I һәм Русия өчен Төньяк сугыш авыр сынау булып торган. Башта, 1700 елны Нарва кырындагы сугышта җиңелеп, урыс армиясе гел чигенә. Карл XII белеп куйган гаскәр башлыгы һәм батыр гаскәр үзен яхшы яктан күрсәтә. Ләкин Карл Польша белән сугышка бүленеп, Русиягә җиңелүләреннән соң кире терелергә вакыт бирә. Шул елларның бер көнендә Пётр I югалтмады. Тупларны кыңгыраулардан агыза башладылар, һәм инде ел аша Русия үткәрә башлады кечкенә җинүләр, Нева елгасында кайсы бер кирмәннәр алынды.
Сугыш нәтиҗәсендә Русия Чуалыш вакытында югалткан Балтыйк буе җирләре өстендә хакимиятне кире кайтарган.


== Моны да карагыз ==
Фёдор Апраксин
Пётр Румянцев
Башкортларның хәрби хезмәте


== Әдәбият ==
Северная война // Энциклопедический словарь Брокгауза и Ефрона: В 86 томах (82 т. и 4 доп.). — СПб., 1890—1907.
Беспалов Александр Викторович. Северная война. Карл XII и шведская армия. Путь от Копенгагена до Переволочной. 1700-1709. — М.: Рейтар, 1998. — 48 с. — 1000 экз. — ISBN 5-8067-0002-X
Бобылёв В. С. Внешняя политика России эпохи Петра I. М., 1990.
Оборона Петербурга и Кроншлота в 1704—1705 гг. // Российская государственность: история и современность. — СПб., 2003. — С. 195—205.
Описание сражения, происходившего 8-го июня 1704 года, между русским и шведами под Нарвою // Походный журнал 1704 года, СПб., 1854. — С. 121—126.
Ростунов И. И., Авдеев В. А., Осипова М. Н., Соколов Ю. Ф. История Северной войны 1700—1721 гг. — Наука. — М., 1987. — 214 с. — 147 000 экз.
Северная война 1700—1721 гг.: Сборник документов. Т. 1 (1700—1709). —"
